{
  "$schema": "http://json-schema.org/draft-07/schema#",
  "$id": "https://perchance.org/mechanics-the-gatherer/mechanics.schema.json",
  "title": "Mechanics the Gatherer — Game Mechanics Interchange Format (v1)",
  "description": "Portable JSON format for importing/exporting board-game feature references (system-level mechanics). Backward-compatible with the Gatherer's inline GAME_DATA: every existing game object validates against the 'game' definition, just wrapped in {schema, version, games:[...]}. A bare game object or bare array of games is also accepted on import (auto-wrapped).",
  "type": "object",
  "required": ["schema", "version", "games"],
  "properties": {
    "schema": {
      "const": "mechanics-gatherer",
      "description": "Fixed discriminator so the format is self-identifying."
    },
    "version": {
      "type": "integer",
      "minimum": 1,
      "description": "Format version. Increment on breaking changes (major) or feature additions (minor — add 'minor' field)."
    },
    "exportedAt": {
      "type": "string",
      "format": "date-time",
      "description": "ISO-8601 timestamp when the file was exported (optional)."
    },
    "source": {
      "type": "string",
      "description": "Where the data came from, e.g. 'BGG Geeklist 177440' (optional)."
    },
    "games": {
      "type": "array",
      "items": { "$ref": "#/definitions/game" }
    }
  },
  "additionalProperties": false,
  "definitions": {
    "game": {
      "type": "object",
      "required": ["id", "title", "categories"],
      "properties": {
        "id": {
          "type": "string",
          "pattern": "^[a-z0-9-]+$",
          "description": "Unique slug: used as the reference-file name and lookup key."
        },
        "title": {
          "type": "string",
          "description": "Display title."
        },
        "intro": {
          "type": "string",
          "description": "One-paragraph system-level summary. No lore/content detail."
        },
        "url": {
          "type": "string",
          "format": "uri",
          "description": "Reference link (e.g. BGG game page) for provenance."
        },
        "tags": {
          "type": "array",
          "items": { "type": "string" },
          "description": "Free-form genre/design tags, e.g. ['farming','life-sim']."
        },
        "categories": {
          "type": "array",
          "items": { "$ref": "#/definitions/category" },
          "description": "Mechanic families. Category 'name' values should stay consistent across games where the same family appears."
        }
      },
      "additionalProperties": false
    },
    "category": {
      "type": "object",
      "required": ["name", "items"],
      "properties": {
        "name": {
          "type": "string",
          "description": "Mechanic family name, e.g. 'Resource Management', 'Worker Placement', 'Deck Building'."
        },
        "items": {
          "type": "array",
          "items": {
            "oneOf": [
              { "type": "string", "description": "Plain mechanic description." },
              { "$ref": "#/definitions/mechanic" }
            ]
          }
        }
      },
      "additionalProperties": false
    },
    "mechanic": {
      "type": "object",
      "required": ["text"],
      "properties": {
        "text": {
          "type": "string",
          "description": "The mechanic description."
        },
        "id": {
          "type": "string",
          "description": "Optional stable identifier for dedupe/linking across games (e.g. 'deck-building' or a hash)."
        },
        "tags": {
          "type": "array",
          "items": { "type": "string" },
          "description": "Optional tags for this individual mechanic."
        }
      },
      "additionalProperties": false
    }
  }
}
